{
  "type": "socialProof",
  "order": 3,
  "headline": "많은 분들이 선택한 데일리 쿠션",
  "subcopy": "판매/순위/리뷰수/재구매율(기준일·출처 각주 필수)",
  "bodyText": [
    "VOC 근거 일상 표현(커버)"
  ],
  "visual": {
    "kind": "photo",
    "ref": null,
    "concept": {
      "subject": "[합성브랜드] 신테틱 톤업 쿠션 21호 제품컷",
      "composition": "정면 중앙 배치, 여백 확보",
      "mood": {
        "color_temp": "warm",
        "lighting": "자연광 소프트",
        "texture": "매트한 데일리 피부 표현"
      },
      "palette": [
        "#F4E9DF",
        "#C9A27A",
        "#7A5C42"
      ],
      "typography": "Pretendard / 부드러운 라운드 굵기",
      "aspect_ratio": "1:1",
      "handoff_note": "누끼 경계 깔끔하게, 그림자 자연스럽게",
      "reference": {
        "own_asset_path": "inputs/assets/ezderm-relief-provided.webp",
        "direction": "큰 숫자와 보조 텍스트, 정렬된 카드 배치",
        "crawl_pattern_ref": "bp:socialProof",
        "pixel_reference_allowed": false
      }
    }
  },
  "claims": [
    {
      "target_text": "누적 판매 다수",
      "claim_strength": "factual",
      "evidence_ref": null,
      "footnote_id": "fn-1"
    }
  ],
  "footnotes": [
    {
      "id": "fn-1",
      "text": "판매 수치는 기준일·집계 출처 표기 필요(자리표시)."
    }
  ],
  "approval_state": "human_approved"
}
