{
  "type": "ingredientTech",
  "order": 6,
  "headline": "성분·기술로 보는 차별점",
  "subcopy": "성분/배합·원료기술·사용편의(meta 근거 한정)",
  "bodyText": [
    "고시성분/구성은 claim-basis 근거 내에서만 표기"
  ],
  "visual": {
    "kind": "photo",
    "ref": null,
    "concept": {
      "subject": "[합성브랜드] 신테틱 톤업 쿠션 21호 제품컷",
      "composition": "정면 중앙 배치, 여백 확보",
      "mood": {
        "color_temp": "warm",
        "lighting": "자연광 소프트",
        "texture": "매트한 데일리 피부 표현"
      },
      "palette": [
        "#F4E9DF",
        "#C9A27A",
        "#7A5C42"
      ],
      "typography": "Pretendard / 부드러운 라운드 굵기",
      "aspect_ratio": "1:1",
      "handoff_note": "누끼 경계 깔끔하게, 그림자 자연스럽게",
      "reference": {
        "own_asset_path": "inputs/assets/ezderm-relief-product.webp",
        "direction": "성분 비주얼과 라벨, 클린한 배경",
        "crawl_pattern_ref": "bp:ingredientTech",
        "pixel_reference_allowed": false
      }
    }
  },
  "claims": [],
  "footnotes": [],
  "approval_state": "human_approved"
}
