{
  "type": "problem",
  "order": 2,
  "headline": "problem — 소비자 고민 환기(voc 근거)",
  "subcopy": "소비자 고민 환기(voc 근거)",
  "bodyText": [
    "VOC 근거 일상 표현(커버)"
  ],
  "visual": {
    "kind": "photo",
    "ref": null,
    "concept": {
      "subject": "[합성브랜드] 신테틱 톤업 쿠션 21호 제품컷",
      "composition": "정면 중앙 배치, 여백 확보",
      "mood": {
        "color_temp": "warm",
        "lighting": "자연광 소프트",
        "texture": "매트한 데일리 피부 표현"
      },
      "palette": [
        "#F4E9DF",
        "#C9A27A",
        "#7A5C42"
      ],
      "typography": "Pretendard / 부드러운 라운드 굵기",
      "aspect_ratio": "1:1",
      "handoff_note": "누끼 경계 깔끔하게, 그림자 자연스럽게",
      "reference": {
        "own_asset_path": "inputs/assets/ezderm-relief-main.webp",
        "direction": "일상 장면 중심, 공감 카피 오버레이 공간",
        "crawl_pattern_ref": "bp:problem",
        "pixel_reference_allowed": false
      }
    }
  },
  "claims": [],
  "footnotes": [],
  "approval_state": "human_approved"
}
