{
  "type": "rtbSummary",
  "order": 5,
  "headline": "이 쿠션을 고르는 이유",
  "subcopy": "핵심 RTB 3-4가지",
  "bodyText": [
    "커버감 좋은 데일리 마무리",
    "촉촉한 사용감",
    "피부 밀착",
    "본품+리필 구성"
  ],
  "visual": {
    "kind": "photo",
    "ref": null,
    "concept": {
      "subject": "[합성브랜드] 신테틱 톤업 쿠션 21호 제품컷",
      "composition": "정면 중앙 배치, 여백 확보",
      "mood": {
        "color_temp": "warm",
        "lighting": "자연광 소프트",
        "texture": "매트한 데일리 피부 표현"
      },
      "palette": [
        "#F4E9DF",
        "#C9A27A",
        "#7A5C42"
      ],
      "typography": "Pretendard / 부드러운 라운드 굵기",
      "aspect_ratio": "1:1",
      "handoff_note": "누끼 경계 깔끔하게, 그림자 자연스럽게",
      "reference": {
        "own_asset_path": "inputs/assets/own-1.svg",
        "direction": "3-4개 균일 그리드, 일관된 간격",
        "crawl_pattern_ref": "bp:rtbSummary",
        "pixel_reference_allowed": false
      }
    }
  },
  "claims": [],
  "footnotes": [],
  "approval_state": "human_approved"
}
