{
  "type": "targetAudience",
  "order": 10,
  "headline": "이런 분께 추천",
  "subcopy": "추천 타겟(가설, 질환 암시 금지)",
  "bodyText": [
    "매일 가볍게 커버가 필요한 분",
    "촉촉한 마무리를 원하는 분",
    "가족 선물을 찾는 분(VOC 가설)"
  ],
  "visual": {
    "kind": "photo",
    "ref": null,
    "concept": {
      "subject": "[합성브랜드] 신테틱 톤업 쿠션 21호 제품컷",
      "composition": "정면 중앙 배치, 여백 확보",
      "mood": {
        "color_temp": "warm",
        "lighting": "자연광 소프트",
        "texture": "매트한 데일리 피부 표현"
      },
      "palette": [
        "#F4E9DF",
        "#C9A27A",
        "#7A5C42"
      ],
      "typography": "Pretendard / 부드러운 라운드 굵기",
      "aspect_ratio": "1:1",
      "handoff_note": "누끼 경계 깔끔하게, 그림자 자연스럽게",
      "reference": {
        "own_asset_path": "inputs/assets/own-6.svg",
        "direction": "인물 분위기 중심, 밝은 일상 톤",
        "crawl_pattern_ref": "bp:targetAudience",
        "pixel_reference_allowed": false
      }
    }
  },
  "claims": [],
  "footnotes": [],
  "approval_state": "human_approved"
}
