{
  "type": "brandBanner",
  "order": 12,
  "headline": "합성브랜드",
  "subcopy": "합성브랜드 헤리티지 배너(브랜드 신뢰)",
  "bodyText": [
    "합성브랜드 브랜드 신뢰 요소"
  ],
  "visual": {
    "kind": "photo",
    "ref": null,
    "concept": {
      "subject": "[합성브랜드] 신테틱 톤업 쿠션 21호 제품컷",
      "composition": "정면 중앙 배치, 여백 확보",
      "mood": {
        "color_temp": "warm",
        "lighting": "자연광 소프트",
        "texture": "매트한 데일리 피부 표현"
      },
      "palette": [
        "#F4E9DF",
        "#C9A27A",
        "#7A5C42"
      ],
      "typography": "Pretendard / 부드러운 라운드 굵기",
      "aspect_ratio": "1:1",
      "handoff_note": "누끼 경계 깔끔하게, 그림자 자연스럽게",
      "reference": {
        "own_asset_path": "inputs/assets/own-8.svg",
        "direction": "브랜드명 중심, 절제된 배경",
        "crawl_pattern_ref": "bp:brandBanner",
        "pixel_reference_allowed": false
      }
    }
  },
  "claims": [],
  "footnotes": [],
  "approval_state": "human_approved"
}
